{
  "caption_occurrence_counts": {
    "figure": 67,
    "table": 266
  },
  "corpus_id": "icc:ibc:2018:structural-inventory",
  "correction_history": [
    {
      "corrected_status": "provisional",
      "corrected_value": 215,
      "correction_id": "ibc2018-correction:caption-occurrence-consolidation",
      "prior_assertion": 266,
      "prior_status": "superseded",
      "reason": "Repeated continuation captions and repeat markers are occurrences, not additional logical tables.",
      "unit": "logical_formally_captioned_tables"
    },
    {
      "corrected_status": "provisional",
      "corrected_value": 215,
      "correction_id": "ibc2018-correction:embedded-table-labels",
      "prior_assertion": 219,
      "prior_status": "rejected",
      "reason": "Four TABLE 2304.10.1 labels on PDF page 556 are embedded labels inside Figure 2308.6.7.2.",
      "unit": "logical_formally_captioned_tables"
    },
    {
      "corrected_status": "provisional",
      "corrected_value": 769,
      "correction_id": "ibc2018-correction:exception-block-count",
      "prior_assertion": 1294,
      "prior_status": "superseded",
      "reason": "Numbered children remain nested evidence and no longer inflate the parent exception-block count.",
      "unit": "explicit_exception_marker_blocks"
    },
    {
      "corrected_status": "provisional",
      "corrected_value": 90,
      "correction_id": "ibc2018-correction:displayed-equation-block-count",
      "prior_assertion": 762,
      "prior_status": "superseded",
      "reason": "The broad lexical scan included prose measurements, unit fragments, standards designations, variable definitions, figure labels, and continuation lines that are not independent displayed equations.",
      "unit": "displayed_equation_or_formula_blocks"
    }
  ],
  "counting_policy_version": "0.1.0",
  "expected_artifact_counts": {
    "attachments": {
      "status": "provisional",
      "value": 2702
    },
    "chapter35_rows": {
      "status": "provisional",
      "value": 555
    },
    "cross_references": {
      "status": "provisional",
      "value": 4615
    },
    "definitions": {
      "status": "provisional",
      "value": 678
    },
    "detections": {
      "status": "provisional",
      "value": 441
    },
    "diagrams": {
      "status": "provisional",
      "value": 2
    },
    "equations": {
      "status": "provisional",
      "value": 90
    },
    "exceptions": {
      "status": "provisional",
      "value": 769
    },
    "external_citations": {
      "status": "provisional",
      "value": 1458
    },
    "external_families": {
      "status": "provisional",
      "value": 555
    },
    "figures": {
      "status": "provisional",
      "value": 56
    },
    "incidental_layouts": {
      "status": "provisional",
      "value": 12
    },
    "semantic_pilot": {
      "status": "provisional",
      "value": 27
    },
    "tables": {
      "status": "provisional",
      "value": 215
    },
    "vector_regions": {
      "status": "provisional",
      "value": 705
    }
  },
  "generated_at": "2026-08-03T20:00:00Z",
  "incidental_layout_counts": {
    "broad": 12,
    "strict": 4
  },
  "inventory_files": [
    "README.md",
    "ibc-2018-attachment-inventory.csv",
    "ibc-2018-attachment-inventory.json",
    "ibc-2018-chapter-35-inventory.csv",
    "ibc-2018-chapter-35-inventory.json",
    "ibc-2018-corpus-manifest.json",
    "ibc-2018-corrections.md",
    "ibc-2018-counting-policy.md",
    "ibc-2018-coverage-report.json",
    "ibc-2018-coverage-report.md",
    "ibc-2018-cross-reference-inventory.csv",
    "ibc-2018-cross-reference-inventory.json",
    "ibc-2018-cross-reference-summary.json",
    "ibc-2018-definition-inventory.csv",
    "ibc-2018-definition-inventory.json",
    "ibc-2018-definition-inventory.md",
    "ibc-2018-detection-inventory.csv",
    "ibc-2018-detection-inventory.json",
    "ibc-2018-diagram-inventory.csv",
    "ibc-2018-diagram-inventory.json",
    "ibc-2018-discrepancies.md",
    "ibc-2018-equation-inventory.csv",
    "ibc-2018-equation-inventory.json",
    "ibc-2018-exception-inventory.csv",
    "ibc-2018-exception-inventory.json",
    "ibc-2018-exception-inventory.md",
    "ibc-2018-external-citation-inventory.csv",
    "ibc-2018-external-citation-inventory.json",
    "ibc-2018-external-reference-inventory.csv",
    "ibc-2018-external-reference-inventory.json",
    "ibc-2018-figure-inventory.csv",
    "ibc-2018-figure-inventory.json",
    "ibc-2018-figure-inventory.md",
    "ibc-2018-incidental-layout-broad-inventory.csv",
    "ibc-2018-incidental-layout-broad-inventory.json",
    "ibc-2018-incidental-layout-inventory.csv",
    "ibc-2018-incidental-layout-inventory.json",
    "ibc-2018-incidental-layout-strict-inventory.csv",
    "ibc-2018-incidental-layout-strict-inventory.json",
    "ibc-2018-page-evidence-index.json",
    "ibc-2018-page-map.json",
    "ibc-2018-reference-crosschecks.json",
    "ibc-2018-reference-map.md",
    "ibc-2018-review-queue.csv",
    "ibc-2018-review-summary.json",
    "ibc-2018-review-summary.md",
    "ibc-2018-schema-validation-report.json",
    "ibc-2018-semantic-pilot-report.md",
    "ibc-2018-semantic-pilot.csv",
    "ibc-2018-semantic-pilot.json",
    "ibc-2018-semantic-review-packet.csv",
    "ibc-2018-semantic-review-packet.md",
    "ibc-2018-source-manifest.json",
    "ibc-2018-source-register.json",
    "ibc-2018-table-inventory.csv",
    "ibc-2018-table-inventory.json",
    "ibc-2018-table-inventory.md",
    "ibc-2018-unresolved-borderline-cases.md",
    "ibc-2018-validation-report.json",
    "ibc-2018-vector-region-inventory.csv",
    "ibc-2018-vector-region-inventory.json",
    "ibc-2018-vector-region-summary.json"
  ],
  "known_limitations": [
    "Inventory acceptance is structural; semantic meaning remains unreviewed unless explicitly stated.",
    "Equation candidates intentionally exclude formula-like cells inside detected formal table and figure regions.",
    "External citation occurrence matching is lexical and preserves unresolved normalizations for review.",
    "Printed source text is retained only in private evidence. Public records use identifiers, coordinates, hashes, and constrained captions.",
    "The completed vector-path scan identified 705 source-backed regions on 413 pages; automatic classification remains conservative and disputed regions require visual review."
  ],
  "parser_version": "ibc-2018-corpus-builder/0.1.0",
  "record_type": "corpus_manifest",
  "reference_crosscheck_file": "ibc-2018-reference-crosschecks.json",
  "schema_version": "0.1.0",
  "source_sha256": "c8f0b75522707a39daf5202edee25d7fdce6c177c382f828a6dc1dfd5cc0b18d",
  "verification_state": "provisional"
}
